{
  "profileVersion": "0",
  "profileId": "openshell-v0.1.2-execution-substrate",
  "acceptedExecutionSubstrate": [
    {"substrateClass": "read-only-runtime", "substrateId": "runtime-usr", "kind": "filesystem", "operation": "read", "locator": {"path": "/usr"}},
    {"substrateClass": "read-only-runtime", "substrateId": "runtime-lib", "kind": "filesystem", "operation": "read", "locator": {"path": "/lib"}},
    {"substrateClass": "read-only-runtime", "substrateId": "runtime-etc", "kind": "filesystem", "operation": "read", "locator": {"path": "/etc"}},
    {"substrateClass": "read-only-runtime", "substrateId": "runtime-app", "kind": "filesystem", "operation": "read", "locator": {"path": "/app"}},
    {"substrateClass": "read-only-runtime", "substrateId": "runtime-var-log", "kind": "filesystem", "operation": "read", "locator": {"path": "/var/log"}},
    {"substrateClass": "read-only-runtime", "substrateId": "runtime-proc", "kind": "filesystem", "operation": "read", "locator": {"path": "/proc"}},
    {"substrateClass": "read-only-runtime", "substrateId": "runtime-urandom", "kind": "filesystem", "operation": "read", "locator": {"path": "/dev/urandom"}},
    {"substrateClass": "read-only-runtime", "substrateId": "runtime-ca", "kind": "filesystem", "operation": "read", "locator": {"path": "/run/openshell-supervisor-ca"}},
    {"substrateClass": "writable-runtime", "substrateId": "runtime-tmp", "kind": "filesystem", "operation": "write", "locator": {"path": "/tmp"}},
    {"substrateClass": "writable-runtime", "substrateId": "runtime-null", "kind": "filesystem", "operation": "write", "locator": {"path": "/dev/null"}},
    {"substrateClass": "restrictive", "substrateId": "runtime-syscall-restriction", "kind": "process"}
  ],
  "targetExecutableRestrictions": [
    {"path": "/usr/bin/curl"}
  ]
}
